{
  "$schema": "https://json-schema.org/draft/2020-12/schema",
  "$id": "urn:react-din:patch-document:v1",
  "title": "react-din PatchDocument v1",
  "description": "Public exchange format for react-din playground patches.",
  "$comment": "PatchDocument is the stable serialized graph contract published by @open-din/react.",
  "type": "object",
  "additionalProperties": false,
  "required": [
    "version",
    "name",
    "nodes",
    "connections",
    "interface"
  ],
  "properties": {
    "version": {
      "const": 1,
      "description": "Schema version for the patch document contract."
    },
    "name": {
      "type": "string",
      "minLength": 1
    },
    "nodes": {
      "type": "array",
      "items": {
        "$ref": "#/$defs/patchNode"
      }
    },
    "connections": {
      "type": "array",
      "items": {
        "$ref": "#/$defs/patchConnection"
      }
    },
    "interface": {
      "$ref": "#/$defs/patchInterface"
    }
  },
  "$defs": {
    "nonEmptyString": {
      "type": "string",
      "minLength": 1
    },
    "nodeType": {
      "type": "string",
      "enum": [
        "osc",
        "gain",
        "filter",
        "delay",
        "reverb",
        "compressor",
        "phaser",
        "flanger",
        "tremolo",
        "eq3",
        "distortion",
        "chorus",
        "noiseBurst",
        "waveShaper",
        "convolver",
        "analyzer",
        "panner3d",
        "panner",
        "mixer",
        "auxSend",
        "auxReturn",
        "matrixMixer",
        "noise",
        "constantSource",
        "mediaStream",
        "sampler",
        "output",
        "math",
        "compare",
        "mix",
        "clamp",
        "switch",
        "input",
        "uiTokens",
        "note",
        "transport",
        "stepSequencer",
        "pianoRoll",
        "eventTrigger",
        "lfo",
        "voice",
        "adsr",
        "midiNote",
        "midiCC",
        "midiNoteOutput",
        "midiCCOutput",
        "midiSync",
        "midiPlayer",
        "patch"
      ]
    },
    "position": {
      "type": "object",
      "additionalProperties": false,
      "required": [
        "x",
        "y"
      ],
      "properties": {
        "x": {
          "type": "number"
        },
        "y": {
          "type": "number"
        }
      }
    },
    "slotType": {
      "type": "string",
      "enum": [
        "audio",
        "midi"
      ]
    },
    "patchSlot": {
      "type": "object",
      "additionalProperties": false,
      "required": [
        "id",
        "label",
        "type"
      ],
      "properties": {
        "id": {
          "$ref": "#/$defs/nonEmptyString"
        },
        "label": {
          "$ref": "#/$defs/nonEmptyString"
        },
        "type": {
          "$ref": "#/$defs/slotType"
        }
      }
    },
    "patchAudioMetadata": {
      "type": "object",
      "additionalProperties": false,
      "required": [
        "input",
        "output"
      ],
      "properties": {
        "input": {
          "$ref": "#/$defs/patchSlot"
        },
        "output": {
          "$ref": "#/$defs/patchSlot"
        }
      }
    },
    "patchNodeData": {
      "type": "object",
      "required": [
        "type"
      ],
      "properties": {
        "type": {
          "$ref": "#/$defs/nodeType"
        },
        "label": {
          "type": "string"
        },
        "patchAsset": {
          "type": "string",
          "description": "Asset path for a nested patch source. The contract accepts .patch.json and .din sources."
        },
        "patchInline": {
          "anyOf": [
            {
              "$ref": "#"
            },
            {
              "type": "null"
            }
          ],
          "description": "Inline nested PatchDocument source. When both patchInline and patchAsset are present, patchInline wins."
        },
        "patchName": {
          "type": "string",
          "description": "Cached display name for the nested patch source."
        },
        "inputs": {
          "type": "array",
          "items": {
            "$ref": "#/$defs/patchSlot"
          },
          "description": "Cached boundary slot metadata for named patch inputs. Default audio in is implicit and not duplicated here."
        },
        "outputs": {
          "type": "array",
          "items": {
            "$ref": "#/$defs/patchSlot"
          },
          "description": "Cached boundary slot metadata for named patch outputs. Default audio out is implicit and not duplicated here."
        },
        "audio": {
          "$ref": "#/$defs/patchAudioMetadata",
          "description": "Cached default audio metadata for the implicit in/out boundary slots."
        }
      },
      "additionalProperties": true
    },
    "patchNode": {
      "type": "object",
      "additionalProperties": false,
      "required": [
        "id",
        "type",
        "data"
      ],
      "properties": {
        "id": {
          "$ref": "#/$defs/nonEmptyString"
        },
        "type": {
          "$ref": "#/$defs/nodeType"
        },
        "position": {
          "$ref": "#/$defs/position"
        },
        "data": {
          "$ref": "#/$defs/patchNodeData"
        }
      }
    },
    "patchConnection": {
      "type": "object",
      "additionalProperties": false,
      "required": [
        "id",
        "source",
        "target"
      ],
      "properties": {
        "id": {
          "$ref": "#/$defs/nonEmptyString"
        },
        "source": {
          "$ref": "#/$defs/nonEmptyString"
        },
        "target": {
          "$ref": "#/$defs/nonEmptyString"
        },
        "sourceHandle": {
          "type": [
            "string",
            "null"
          ]
        },
        "targetHandle": {
          "type": [
            "string",
            "null"
          ]
        }
      }
    },
    "patchInput": {
      "type": "object",
      "additionalProperties": false,
      "required": [
        "id",
        "key",
        "label",
        "kind",
        "nodeId",
        "paramId",
        "handle",
        "defaultValue",
        "min",
        "max"
      ],
      "properties": {
        "id": {
          "$ref": "#/$defs/nonEmptyString"
        },
        "key": {
          "$ref": "#/$defs/nonEmptyString"
        },
        "label": {
          "$ref": "#/$defs/nonEmptyString"
        },
        "kind": {
          "const": "input"
        },
        "nodeId": {
          "$ref": "#/$defs/nonEmptyString"
        },
        "paramId": {
          "$ref": "#/$defs/nonEmptyString"
        },
        "handle": {
          "$ref": "#/$defs/nonEmptyString"
        },
        "defaultValue": {
          "type": "number"
        },
        "min": {
          "type": "number"
        },
        "max": {
          "type": "number"
        }
      }
    },
    "patchEvent": {
      "type": "object",
      "additionalProperties": false,
      "required": [
        "id",
        "key",
        "label",
        "kind",
        "nodeId"
      ],
      "properties": {
        "id": {
          "$ref": "#/$defs/nonEmptyString"
        },
        "key": {
          "$ref": "#/$defs/nonEmptyString"
        },
        "label": {
          "$ref": "#/$defs/nonEmptyString"
        },
        "kind": {
          "const": "event"
        },
        "nodeId": {
          "$ref": "#/$defs/nonEmptyString"
        }
      }
    },
    "patchMidiNoteInput": {
      "type": "object",
      "additionalProperties": false,
      "required": [
        "id",
        "key",
        "label",
        "kind",
        "nodeId"
      ],
      "properties": {
        "id": {
          "$ref": "#/$defs/nonEmptyString"
        },
        "key": {
          "$ref": "#/$defs/nonEmptyString"
        },
        "label": {
          "$ref": "#/$defs/nonEmptyString"
        },
        "kind": {
          "const": "midi-note-input"
        },
        "nodeId": {
          "$ref": "#/$defs/nonEmptyString"
        },
        "inputId": {
          "type": [
            "string",
            "null"
          ]
        },
        "channel": {
          "anyOf": [
            {
              "type": "integer",
              "minimum": 1,
              "maximum": 16
            },
            {
              "const": "all"
            }
          ]
        },
        "noteMode": {
          "enum": [
            "all",
            "single",
            "range"
          ]
        },
        "note": {
          "type": "integer",
          "minimum": 0,
          "maximum": 127
        },
        "noteMin": {
          "type": "integer",
          "minimum": 0,
          "maximum": 127
        },
        "noteMax": {
          "type": "integer",
          "minimum": 0,
          "maximum": 127
        }
      }
    },
    "patchMidiCCInput": {
      "type": "object",
      "additionalProperties": false,
      "required": [
        "id",
        "key",
        "label",
        "kind",
        "nodeId",
        "cc"
      ],
      "properties": {
        "id": {
          "$ref": "#/$defs/nonEmptyString"
        },
        "key": {
          "$ref": "#/$defs/nonEmptyString"
        },
        "label": {
          "$ref": "#/$defs/nonEmptyString"
        },
        "kind": {
          "const": "midi-cc-input"
        },
        "nodeId": {
          "$ref": "#/$defs/nonEmptyString"
        },
        "inputId": {
          "type": [
            "string",
            "null"
          ]
        },
        "channel": {
          "anyOf": [
            {
              "type": "integer",
              "minimum": 1,
              "maximum": 16
            },
            {
              "const": "all"
            }
          ]
        },
        "cc": {
          "type": "integer",
          "minimum": 0,
          "maximum": 127
        }
      }
    },
    "patchMidiNoteOutput": {
      "type": "object",
      "additionalProperties": false,
      "required": [
        "id",
        "key",
        "label",
        "kind",
        "nodeId"
      ],
      "properties": {
        "id": {
          "$ref": "#/$defs/nonEmptyString"
        },
        "key": {
          "$ref": "#/$defs/nonEmptyString"
        },
        "label": {
          "$ref": "#/$defs/nonEmptyString"
        },
        "kind": {
          "const": "midi-note-output"
        },
        "nodeId": {
          "$ref": "#/$defs/nonEmptyString"
        },
        "outputId": {
          "type": [
            "string",
            "null"
          ]
        },
        "channel": {
          "type": "integer",
          "minimum": 1,
          "maximum": 16
        },
        "note": {
          "type": "integer",
          "minimum": 0,
          "maximum": 127
        },
        "frequency": {
          "type": "number",
          "exclusiveMinimum": 0
        },
        "velocity": {
          "type": "number",
          "minimum": 0,
          "maximum": 1
        }
      }
    },
    "patchMidiCCOutput": {
      "type": "object",
      "additionalProperties": false,
      "required": [
        "id",
        "key",
        "label",
        "kind",
        "nodeId",
        "cc"
      ],
      "properties": {
        "id": {
          "$ref": "#/$defs/nonEmptyString"
        },
        "key": {
          "$ref": "#/$defs/nonEmptyString"
        },
        "label": {
          "$ref": "#/$defs/nonEmptyString"
        },
        "kind": {
          "const": "midi-cc-output"
        },
        "nodeId": {
          "$ref": "#/$defs/nonEmptyString"
        },
        "outputId": {
          "type": [
            "string",
            "null"
          ]
        },
        "channel": {
          "type": "integer",
          "minimum": 1,
          "maximum": 16
        },
        "cc": {
          "type": "integer",
          "minimum": 0,
          "maximum": 127
        },
        "valueFormat": {
          "enum": [
            "normalized",
            "raw"
          ]
        }
      }
    },
    "patchMidiSyncOutput": {
      "type": "object",
      "additionalProperties": false,
      "required": [
        "id",
        "key",
        "label",
        "kind",
        "nodeId",
        "mode"
      ],
      "properties": {
        "id": {
          "$ref": "#/$defs/nonEmptyString"
        },
        "key": {
          "$ref": "#/$defs/nonEmptyString"
        },
        "label": {
          "$ref": "#/$defs/nonEmptyString"
        },
        "kind": {
          "const": "midi-sync-output"
        },
        "nodeId": {
          "$ref": "#/$defs/nonEmptyString"
        },
        "mode": {
          "enum": [
            "midi-master",
            "transport-master"
          ]
        },
        "inputId": {
          "type": [
            "string",
            "null"
          ]
        },
        "outputId": {
          "type": [
            "string",
            "null"
          ]
        },
        "sendStartStop": {
          "type": "boolean"
        },
        "sendClock": {
          "type": "boolean"
        }
      }
    },
    "patchInterface": {
      "type": "object",
      "additionalProperties": false,
      "required": [
        "inputs",
        "events",
        "midiInputs",
        "midiOutputs"
      ],
      "properties": {
        "inputs": {
          "type": "array",
          "items": {
            "$ref": "#/$defs/patchInput"
          }
        },
        "events": {
          "type": "array",
          "items": {
            "$ref": "#/$defs/patchEvent"
          }
        },
        "midiInputs": {
          "type": "array",
          "items": {
            "oneOf": [
              {
                "$ref": "#/$defs/patchMidiNoteInput"
              },
              {
                "$ref": "#/$defs/patchMidiCCInput"
              }
            ]
          }
        },
        "midiOutputs": {
          "type": "array",
          "items": {
            "oneOf": [
              {
                "$ref": "#/$defs/patchMidiNoteOutput"
              },
              {
                "$ref": "#/$defs/patchMidiCCOutput"
              },
              {
                "$ref": "#/$defs/patchMidiSyncOutput"
              }
            ]
          }
        }
      }
    }
  }
}
